{
  "schemaVersion": 1,
  "runId": "tui-qa-02-baseline-20260901",
  "runClass": "baseline",
  "certifying": true,
  "startedAt": "2026-09-01T14:18:56.166Z",
  "finishedAt": "2026-09-01T14:19:45.467Z",
  "durationMs": 49301,
  "revision": {
    "base": "77450807563cbe80bb28cfdb86c187a4be6ac809",
    "head": "59e88eb8f481fc16db5f905ba955006fa07e065d",
    "worktreeDirty": false
  },
  "binary": {
    "path": "<run-binary>/agent-marketplace",
    "sha256": "af64f4a389d461cf6a790b69de7a9ad6c45ac4edc8a1c490de77fc46486891bf",
    "buildClass": "release-equivalent",
    "cgoEnabled": false,
    "goVersion": "go1.26.6",
    "goos": "linux",
    "goarch": "arm64",
    "command": [
      "go",
      "build",
      "-o",
      "<run-binary>/agent-marketplace",
      "-ldflags",
      "-X main.version=tui-qa-59e88eb8f481fc16db5f905ba955006fa07e065d",
      "./cmd/agent-marketplace"
    ],
    "tags": [],
    "ldflags": [
      "-X main.version=tui-qa-59e88eb8f481fc16db5f905ba955006fa07e065d"
    ]
  },
  "classifier": {
    "version": "invariant-v1",
    "input": {
      "requestedFlowIds": [
        "bare-non-tty-help",
        "frame-baseline-80x24",
        "frame-constrained-50x12",
        "launch-bare-tty",
        "launch-explicit-tui",
        "no-tui-env",
        "no-tui-flag",
        "org-fallback",
        "quit-ctrl-c",
        "quit-q",
        "quit-sigterm",
        "tui-without-tty"
      ]
    },
    "selections": [
      {
        "flowId": "bare-non-tty-help",
        "reason": "required invariant matrix"
      },
      {
        "flowId": "frame-baseline-80x24",
        "reason": "required invariant matrix"
      },
      {
        "flowId": "frame-constrained-50x12",
        "reason": "required invariant matrix"
      },
      {
        "flowId": "launch-bare-tty",
        "reason": "required invariant matrix"
      },
      {
        "flowId": "launch-explicit-tui",
        "reason": "required invariant matrix"
      },
      {
        "flowId": "no-tui-env",
        "reason": "required invariant matrix"
      },
      {
        "flowId": "no-tui-flag",
        "reason": "required invariant matrix"
      },
      {
        "flowId": "org-fallback",
        "reason": "required invariant matrix"
      },
      {
        "flowId": "quit-ctrl-c",
        "reason": "required invariant matrix"
      },
      {
        "flowId": "quit-q",
        "reason": "required invariant matrix"
      },
      {
        "flowId": "quit-sigterm",
        "reason": "required invariant matrix"
      },
      {
        "flowId": "tui-without-tty",
        "reason": "required invariant matrix"
      }
    ]
  },
  "fixture": {
    "id": "local-bare-git-registry-v1",
    "version": "1",
    "source": "local-synthetic"
  },
  "tools": {
    "nodeVersion": "v24.18.0",
    "npmVersion": "11.16.0",
    "driver": {
      "name": "@microsoft/tui-test",
      "version": "0.0.4"
    }
  },
  "environment": {
    "AM_TUI_QA_RUN_ID": "tui-qa-02-baseline-20260901",
    "AM_TUI_QA_RUN_CLASS": "baseline",
    "AM_TUI_QA_RETRIES": "1"
  },
  "limits": {
    "semanticWaitMs": 5000,
    "longOperationWaitMs": 30000,
    "flowTimeoutMs": 120000,
    "maxRetries": 1,
    "transcriptCapBytes": 10485760,
    "uploadCapBytes": 104857600
  },
  "artifactPolicy": {
    "retentionDays": 0,
    "rawAnsiLocalOnly": true,
    "exceptionalRawUpload": false,
    "secretScanRequired": true,
    "uploadBytes": 49380,
    "uploadCapBytes": 104857600,
    "truncated": false
  },
  "flows": [
    {
      "flowId": "bare-non-tty-help",
      "kind": "invariant",
      "driver": "command",
      "boundary": "non-tty-process",
      "required": true,
      "status": "PASS",
      "selectionReason": "required invariant matrix",
      "fixtureId": "local-bare-git-registry-v1",
      "expectedFailureClass": null,
      "terminal": {
        "profileId": "non-tty",
        "columns": 80,
        "rows": 24
      },
      "attempts": [
        {
          "attemptId": "bare-non-tty-help/a1",
          "attempt": 1,
          "sandboxId": "tui-qa-tui-qa-02-baseline-20260901-bare-non-tty-help-a1-NG9Nv8",
          "startedAt": "2026-09-01T14:18:56.190Z",
          "finishedAt": "2026-09-01T14:18:56.280Z",
          "status": "PASS",
          "exitCode": 0,
          "signal": null,
          "durationMs": 90,
          "observedFailureClass": null,
          "productRestoration": {
            "canonical": "NOT_APPLICABLE",
            "echo": "NOT_APPLICABLE",
            "alternateScreenExited": "NOT_APPLICABLE",
            "cursorVisible": "NOT_APPLICABLE",
            "mouseDisabled": "NOT_APPLICABLE",
            "bracketedPasteDisabled": "NOT_APPLICABLE",
            "complete": false
          },
          "harnessRecovery": {
            "applied": false,
            "canonical": "NOT_APPLICABLE",
            "echo": "NOT_APPLICABLE",
            "noDescendants": "PASS",
            "complete": true
          }
        }
      ],
      "assertions": [
        {
          "id": "flow-outcome",
          "status": "PASS",
          "expected": "bare invocation without a TTY prints help and exits cleanly",
          "observed": "passed"
        }
      ],
      "sideEffects": {
        "rootClass": "declared-application-roots",
        "beforeDigest": "5f1c7cd89e3631fc561f010a539dd1c679cf7b176296ed96f5f8aabf97bf994d",
        "afterDigest": "7d7f9ed694d13160325c890b540fbb24cdd333621a4b1c382192f4e619a34af5",
        "changedPaths": [
          "logs/agent-marketplace.log"
        ],
        "truncated": false
      },
      "evidence": [
        {
          "path": "flows/bare-non-tty-help/attempt-1/driver-log.txt",
          "sha256": "c78607a7b293e93c2497b07772c3276fb011c87152f5fda81b8a7edd0a6fd29d",
          "bytes": 1789,
          "kind": "driver-log",
          "sanitized": true,
          "sanitization": "transformed",
          "localOnly": false,
          "truncated": false
        },
        {
          "path": "flows/bare-non-tty-help/attempt-1/process-cleanup.json",
          "sha256": "51af5624e927d7462b68e77f789aa765a5d3ed69d4ede4d30ff26e56e3c2ef51",
          "bytes": 123,
          "kind": "process-cleanup",
          "sanitized": true,
          "sanitization": "transformed",
          "localOnly": false,
          "truncated": false
        }
      ]
    },
    {
      "flowId": "frame-baseline-80x24",
      "kind": "invariant",
      "driver": "pty",
      "boundary": "real-pty-process",
      "required": true,
      "status": "PASS",
      "selectionReason": "required invariant matrix",
      "fixtureId": "local-bare-git-registry-v1",
      "expectedFailureClass": null,
      "terminal": {
        "profileId": "80x24",
        "columns": 80,
        "rows": 24
      },
      "attempts": [
        {
          "attemptId": "frame-baseline-80x24/a1",
          "attempt": 1,
          "sandboxId": "tui-qa-tui-qa-02-baseline-20260901-frame-baseline-80x24-a1-zgTwSf",
          "startedAt": "2026-09-01T14:18:56.281Z",
          "finishedAt": "2026-09-01T14:19:01.780Z",
          "status": "PASS",
          "exitCode": 0,
          "signal": null,
          "durationMs": 5499,
          "observedFailureClass": null,
          "productRestoration": {
            "canonical": "PASS",
            "echo": "PASS",
            "alternateScreenExited": "PASS",
            "cursorVisible": "PASS",
            "mouseDisabled": "PASS",
            "bracketedPasteDisabled": "PASS",
            "complete": true
          },
          "harnessRecovery": {
            "applied": true,
            "canonical": "PASS",
            "echo": "PASS",
            "noDescendants": "PASS",
            "complete": true
          }
        }
      ],
      "assertions": [
        {
          "id": "flow-outcome",
          "status": "PASS",
          "expected": "the first nonblank baseline frame fits 80x24 with trusted chrome",
          "observed": "passed"
        }
      ],
      "sideEffects": {
        "rootClass": "declared-application-roots",
        "beforeDigest": "16bad80f2476b0cdc129bd4b706fe8c98128f326b6ce0d12017f2ab54ff5a3f9",
        "afterDigest": "fc4c7ffc59ee168d65953e788fb23d99240f68300b37ce6bc58f83c8c5fbcdef",
        "changedPaths": [
          "home/.cache/agent-marketplace/41415fb3e022ad47/main/.git/FETCH_HEAD",
          "home/.cache/agent-marketplace/41415fb3e022ad47/main/.git/logs/HEAD",
          "logs/agent-marketplace.log"
        ],
        "truncated": false
      },
      "evidence": [
        {
          "path": "flows/frame-baseline-80x24/attempt-1/driver-log.txt",
          "sha256": "632093b69359ee2cdc031082b58274b70ce706b0cf50ded771bae6bb467037c2",
          "bytes": 38,
          "kind": "driver-log",
          "sanitized": true,
          "sanitization": "transformed",
          "localOnly": false,
          "truncated": false
        },
        {
          "path": "flows/frame-baseline-80x24/attempt-1/flow-result.json",
          "sha256": "6a7d2b0262ac3e4cf750f122bb197a88161218913b5c2da1a94f44c6d5be3fd2",
          "bytes": 71,
          "kind": "other",
          "sanitized": true,
          "sanitization": "transformed",
          "localOnly": false,
          "truncated": false
        },
        {
          "path": "flows/frame-baseline-80x24/attempt-1/frame.snapshot.txt",
          "sha256": "7a888d382c2cf372718565976ce9b849697f3e7b32d95fa364064b72a62cd28c",
          "bytes": 1956,
          "kind": "sanitized-frame",
          "sanitized": true,
          "sanitization": "transformed",
          "localOnly": false,
          "truncated": false
        },
        {
          "path": "flows/frame-baseline-80x24/attempt-1/lifecycle/lifecycle-124.json",
          "sha256": "479c8e13e84e8dbc1ad71919fb503fe31c260d0566ffbebed9a10b135b736c58",
          "bytes": 363,
          "kind": "other",
          "sanitized": true,
          "sanitization": "transformed",
          "localOnly": false,
          "truncated": false